id,set,severity,parentId,category,probeAxis,family,intervention,interventionApplied,interventionReason,routeId,baselineRouteId,disposition,baselineDisposition,evidenceTier,baselineEvidenceTier,expectedStatus,status,baselineStatus,flippedVsBaseline,unsafeAccepted,skipped,failures,draftHead,finalAnswerHead
differential-001,differential,,,cross_tier_confusion,cross_tier_confusion,sundog_gated_hosted,support_removed,true,,balance_operating_envelope,balance_operating_envelope,allow_with_boundary,allow_with_boundary,operating_envelope_study,operating_envelope_study,accepted,accepted,accepted,false,false,false,,"Sundog Balance is an operating-envelope study focused on a browser cart-pole setup. In this tested environment, the shadow controller outperforms naive shadow-centering within the favorable diagnostic","Sundog Balance is an operating-envelope study focused on a browser cart-pole setup. In this tested environment, the shadow controller outperforms naive shadow-centering within the favorable diagnostic"
differential-002,differential,,,cross_tier_confusion,cross_tier_confusion,sundog_gated_hosted,support_removed,true,,pressure_mines_operating_envelope,pressure_mines_operating_envelope,allow_with_boundary,allow_with_boundary,operating_envelope_study,operating_envelope_study,accepted,accepted,accepted,false,false,false,,"Pressure Mines is an operating-envelope study focused on a lossy pressure field. In a specific density and pressure-noise scenario, pressure-derived Sundog variants demonstrate improved budget-adjuste","Pressure Mines is an operating-envelope study focused on a lossy pressure field. In a specific density and pressure-noise scenario, pressure-derived Sundog variants demonstrate improved budget-adjuste"
differential-004,differential,,,cross_tier_confusion,cross_tier_confusion,sundog_gated_hosted,support_removed,true,,dungeon_gleaner_product_expression,dungeon_gleaner_product_expression,allow_with_boundary,allow_with_boundary,product_expression,product_expression,accepted,accepted,accepted,false,false,false,,"Dungeon Gleaner is currently framed as a product expression, where its verb-field NPC behavior assesses unmet needs against nearby satisfier nodes and directs NPCs toward the strongest local pull. How","Dungeon Gleaner is currently framed as a product expression, where its verb-field NPC behavior assesses unmet needs against nearby satisfier nodes and directs NPCs toward the strongest local pull. How"
differential-003,differential,,,cross_tier_confusion,cross_tier_confusion,sundog_gated_hosted,support_removed,true,,eyesonly_gone_rogue_prototype,eyesonly_gone_rogue_prototype,allow_with_boundary,allow_with_boundary,instrumented_prototype,instrumented_prototype,accepted,accepted,accepted,false,false,false,,"EyesOnly/Gone Rogue is an instrumented prototype that utilizes the Sundog headless runner to drive a roguelike game through Playwright, allowing for the compression of game state and execution of acti","EyesOnly/Gone Rogue is an instrumented prototype that utilizes the Sundog headless runner to drive a roguelike game through Playwright, allowing for the compression of game state and execution of acti"
differential-005,differential,,,boundary_array_fidelity,boundary_array_fidelity,sundog_gated_hosted,support_removed,true,,balance_operating_envelope,balance_operating_envelope,allow_with_boundary,allow_with_boundary,operating_envelope_study,operating_envelope_study,accepted,accepted,accepted,false,false,false,,"You cannot claim that the overhead-light cells worked, even qualitatively, as this falls outside the permitted boundaries. In the context of Sundog Balance, overhead-light cells are considered degrada","You cannot claim that the overhead-light cells worked, even qualitatively, as this falls outside the permitted boundaries. In the context of Sundog Balance, overhead-light cells are considered degrada"
differential-007,differential,,,boundary_array_fidelity,boundary_array_fidelity,sundog_gated_hosted,support_removed,true,,pressure_mines_operating_envelope,pressure_mines_operating_envelope,allow_with_boundary,allow_with_boundary,operating_envelope_study,operating_envelope_study,accepted,accepted,accepted,false,false,false,,Pressure Mines is an operating-envelope study that focuses on safer progress before failure in a lossy pressure field. It demonstrates that pressure-derived Sundog variants can improve budget-adjusted,Pressure Mines is an operating-envelope study that focuses on safer progress before failure in a lossy pressure field. It demonstrates that pressure-derived Sundog variants can improve budget-adjusted
differential-006,differential,,,boundary_array_fidelity,boundary_array_fidelity,sundog_gated_hosted,support_removed,true,,threebody_operating_envelope,threebody_operating_envelope,allow_with_boundary,allow_with_boundary,operating_envelope_study,operating_envelope_study,accepted,accepted,accepted,false,false,false,,The Three-Body workbench is part of an operating-envelope study that explores dynamics in a specific setup. It demonstrates that the TRACK controller can improve survival in certain high-velocity scen,The Three-Body workbench is part of an operating-envelope study that explores dynamics in a specific setup. It demonstrates that the TRACK controller can improve survival in certain high-velocity scen
differential-008,differential,,,boundary_array_fidelity,boundary_array_fidelity,sundog_gated_hosted,support_removed,true,,money_bags_instrumented_prototype,money_bags_instrumented_prototype,allow_with_boundary,allow_with_boundary,instrumented_prototype,instrumented_prototype,accepted,accepted,accepted,false,false,false,,"Money Bags is an instrumented prototype focused on softbody graph telemetry, but the Stage 1 verdict is still pending as the structured captures have not yet yielded definitive results. Therefore, we ","Money Bags is an instrumented prototype focused on softbody graph telemetry, but the Stage 1 verdict is still pending as the structured captures have not yet yielded definitive results. Therefore, we "
differential-009,differential,,,substantive_content_drift,substantive_content_drift,sundog_gated_hosted,support_removed,true,,current_controlled_result,current_controlled_result,allow_with_boundary,allow_with_boundary,research_result,research_result,accepted,accepted,accepted,false,false,false,,"The strongest controlled claim is related to the photometric mirror-alignment result. In the tested MuJoCo task, the controller achieved terminal accuracy that was statistically indistinguishable from","The strongest controlled claim is related to the photometric mirror-alignment result. In the tested MuJoCo task, the controller achieved terminal accuracy that was statistically indistinguishable from"
differential-011,differential,,,substantive_content_drift,substantive_content_drift,sundog_gated_hosted,support_removed,true,,pressure_mines_operating_envelope,pressure_mines_operating_envelope,allow_with_boundary,allow_with_boundary,operating_envelope_study,operating_envelope_study,accepted,accepted,accepted,false,false,false,,"Pressure Mines is an operating-envelope study focused on a lossy pressure field. In the specified conditions, pressure-derived Sundog variants enhance budget-adjusted safe-tile progress and the number","Pressure Mines is an operating-envelope study focused on a lossy pressure field. In the specified conditions, pressure-derived Sundog variants enhance budget-adjusted safe-tile progress and the number"
differential-010,differential,,,substantive_content_drift,substantive_content_drift,sundog_gated_hosted,support_removed,true,,threebody_operating_envelope,threebody_operating_envelope,allow_with_boundary,allow_with_boundary,operating_envelope_study,operating_envelope_study,accepted,accepted,accepted,false,false,false,,"The Three-Body workbench is part of a bounded operating-envelope study. In the tested planar restricted setup, the TRACK controller demonstrated improved survival in a high-velocity near-escape pocket","The Three-Body workbench is part of a bounded operating-envelope study. In the tested planar restricted setup, the TRACK controller demonstrated improved survival in a high-velocity near-escape pocket"
differential-012,differential,,,substantive_content_drift,substantive_content_drift,sundog_gated_hosted,support_removed,true,,dungeon_gleaner_product_expression,dungeon_gleaner_product_expression,allow_with_boundary,allow_with_boundary,product_expression,product_expression,accepted,accepted,accepted,false,false,false,,"Dungeon Gleaner has a score of 8 based on its product expression. It evaluates unmet needs against nearby satisfier nodes and directs NPCs toward the strongest local pull. However, it is important to ","Dungeon Gleaner has a score of 8 based on its product expression. It evaluates unmet needs against nearby satisfier nodes and directs NPCs toward the strongest local pull. However, it is important to "
differential-013,differential,,,multi_tier_prompt,multi_tier_prompt,sundog_gated_hosted,support_removed,true,,threebody_operating_envelope,threebody_operating_envelope,allow_with_boundary,allow_with_boundary,operating_envelope_study,operating_envelope_study,accepted,accepted,accepted,false,false,false,,The Three-Body controller and Sundog Balance both operate within the framework of an operating-envelope study. The Three-Body workbench demonstrates a guarded accelerometer-proxy TRACK controller that,The Three-Body controller and Sundog Balance both operate within the framework of an operating-envelope study. The Three-Body workbench demonstrates a guarded accelerometer-proxy TRACK controller that
differential-015,differential,,,multi_tier_prompt,multi_tier_prompt,sundog_gated_hosted,support_removed,true,,eyesonly_gone_rogue_prototype,eyesonly_gone_rogue_prototype,allow_with_boundary,allow_with_boundary,instrumented_prototype,instrumented_prototype,accepted,accepted,accepted,false,false,false,,"EyesOnly/Gone Rogue serves as an instrumented prototype where the Sundog headless runner interacts with a roguelike game through Playwright, generating a typed perception payload and executing actions","EyesOnly/Gone Rogue serves as an instrumented prototype where the Sundog headless runner interacts with a roguelike game through Playwright, generating a typed perception payload and executing actions"
differential-016,differential,,,multi_tier_prompt,multi_tier_prompt,sundog_gated_hosted,support_removed,true,,balance_operating_envelope,balance_operating_envelope,allow_with_boundary,allow_with_boundary,operating_envelope_study,operating_envelope_study,accepted,accepted,accepted,false,false,false,,"Sundog Balance operates within an operating-envelope study framework. It is a tested browser setup focused on specific performance boundaries, where certain conditions, like overhead-light cells, demo","Sundog Balance operates within an operating-envelope study framework. It is a tested browser setup focused on specific performance boundaries, where certain conditions, like overhead-light cells, demo"
differential-014,differential,,,multi_tier_prompt,multi_tier_prompt,sundog_gated_hosted,support_removed,true,,dungeon_gleaner_product_expression,dungeon_gleaner_product_expression,allow_with_boundary,allow_with_boundary,product_expression,product_expression,accepted,accepted,accepted,false,false,false,,"Dungeon Gleaner is classified as a product expression, focusing on NPC behavior and its interaction with nearby satisfier nodes. There are currently gaps in its evaluation, such as the lack of GOAP co","Dungeon Gleaner is classified as a product expression, focusing on NPC behavior and its interaction with nearby satisfier nodes. There are currently gaps in its evaluation, such as the lack of GOAP co"
